{
  "schema_version": "1.0.0",
  "bundle_id": "contract-fixture-cars-v1",
  "model_version": "1.0.0",
  "artifact_status": "contract_fixture",
  "model": {
    "filename": "contract-fixture.onnx",
    "format": "ONNX",
    "sha256": "1111111111111111111111111111111111111111111111111111111111111111",
    "size_bytes": 1234
  },
  "class_map": {
    "filename": "class-map.json",
    "schema_version": "1.0.0",
    "catalog_id": "contract-fixture-cars-v1",
    "class_count": 3,
    "sha256": "583ce20cdee31ab1d450e007deaa202ec0fd42eb3c188a4354a8c6f05e9f9698"
  },
  "input": {
    "tensor_name": "images",
    "element_type": "float32",
    "layout": "NCHW",
    "shape": [1, 3, 224, 224],
    "color_order": "RGB"
  },
  "preprocessing": {
    "orientation": "apply_exif_then_strip_metadata",
    "resize": {
      "mode": "shorter_side",
      "shorter_side": 256,
      "interpolation": "bilinear"
    },
    "crop": {
      "mode": "center",
      "height": 224,
      "width": 224
    },
    "value_scale": 0.00392156862745098,
    "normalization": {
      "mean": [0.485, 0.456, 0.406],
      "std": [0.229, 0.224, 0.225]
    }
  },
  "output": {
    "tensor_name": "logits",
    "element_type": "float32",
    "shape": [1, 3],
    "class_axis": 1,
    "semantics": "logits",
    "score_transform": "softmax",
    "ranking": "descending_score_then_ascending_class_index",
    "top_k": 3
  },
  "onnx_runtime": {
    "opset": 17,
    "minimum_version": "1.17.0",
    "required_execution_providers": ["CPUExecutionProvider"]
  },
  "licenses": {
    "model_spdx_expression": "LicenseRef-ContractFixture",
    "notice_files": ["NOTICE.contract-fixture.txt"],
    "source_artifacts": [
      {
        "name": "Synthetic contract fixture",
        "source_url": "https://github.com/infopek/categorizer",
        "license": "LicenseRef-ContractFixture",
        "license_url": "https://github.com/infopek/categorizer"
      }
    ]
  }
}
